Enter password: ****
Welcome to the MySQL monitor.  Commands end with ; or \g.
Your MySQL connection id is 1
Server version: 5.5.61 MySQL Community Server (GPL)

Copyright (c) 2000, 2018, Oracle and/or its affiliates. All rights reserved.

Oracle is a registered trademark of Oracle Corporation and/or its
affiliates. Other names may be trademarks of their respective
owners.

Type 'help;' or '\h' for help. Type '\c' to clear the current input statement.

mysql> show databases;
+--------------------+
| Database           |
+--------------------+
| information_schema |
| assignment         |
| db                 |
| dbda               |
| mydb               |
| mysql              |
| nikita             |
| nirmal             |
| performance_schema |
| test               |
| vita               |
| vita_db            |
| vita_dbda          |
| whitehouse         |
+--------------------+
14 rows in set (0.18 sec)

mysql> use whitehouse;
Database changed
mysql> create databases;
ERROR 1064 (42000): You have an error in your SQL syntax; check the manual that corresponds to your MySQL server version for the right syntax to use near 'databases' at line 1
mysql> create database vaibhav;
Query OK, 1 row affected (0.01 sec)

mysql> show database;
ERROR 1064 (42000): You have an error in your SQL syntax; check the manual that corresponds to your MySQL server version for the right syntax to use near 'database' at line 1
mysql> show databases;
+--------------------+
| Database           |
+--------------------+
| information_schema |
| assignment         |
| db                 |
| dbda               |
| mydb               |
| mysql              |
| nikita             |
| nirmal             |
| performance_schema |
| test               |
| vaibhav            |
| vita               |
| vita_db            |
| vita_dbda          |
| whitehouse         |
+--------------------+
15 rows in set (0.00 sec)

mysql> use vaibhav;
Database changed
mysql> create table vv (ProductID int primary key, ProductName varchar(30));
Query OK, 0 rows affected (0.15 sec)

mysql> select*from vv;
Empty set (0.00 sec)

mysql> insert into vv values (1,'Patanjali Shampoo');
Query OK, 1 row affected (0.04 sec)

mysql> insert into vv values (2,'soap');
Query OK, 1 row affected (0.03 sec)

mysql> insert into vv values (3,'oil');
Query OK, 1 row affected (0.02 sec)

mysql> insert into vv values (4,'maggiee');
Query OK, 1 row affected (0.03 sec)

mysql> select*from vv;
+-----------+-------------------+
| ProductID | ProductName       |
+-----------+-------------------+
|         1 | Patanjali Shampoo |
|         2 | soap              |
|         3 | oil               |
|         4 | maggiee           |
+-----------+-------------------+
4 rows in set (0.00 sec)

mysql> create table textdatatype (a char(20) b varchar(20) c text );
ERROR 1064 (42000): You have an error in your SQL syntax; check the manual that corresponds to your MySQL server version for the right syntax to use near 'b varchar(20) c text )' at line 1
mysql> create table textdatatype (a char(20), b varchar(20), c text );
Query OK, 0 rows affected (0.06 sec)

mysql> describe textdatatypes;
ERROR 1146 (42S02): Table 'vaibhav.textdatatypes' doesn't exist
mysql> describe textdatatype;
+-------+-------------+------+-----+---------+-------+
| Field | Type        | Null | Key | Default | Extra |
+-------+-------------+------+-----+---------+-------+
| a     | char(20)    | YES  |     | NULL    |       |
| b     | varchar(20) | YES  |     | NULL    |       |
| c     | text        | YES  |     | NULL    |       |
+-------+-------------+------+-----+---------+-------+
3 rows in set (0.01 sec)

mysql> describe vv;
+-------------+-------------+------+-----+---------+-------+
| Field       | Type        | Null | Key | Default | Extra |
+-------------+-------------+------+-----+---------+-------+
| ProductID   | int(11)     | NO   | PRI | NULL    |       |
| ProductName | varchar(30) | YES  |     | NULL    |       |
+-------------+-------------+------+-----+---------+-------+
2 rows in set (0.01 sec)

mysql> show table;
ERROR 1064 (42000): You have an error in your SQL syntax; check the manual that corresponds to your MySQL server version for the right syntax to use near '' at line 1
mysql> show tables;
+-------------------+
| Tables_in_vaibhav |
+-------------------+
| textdatatype      |
| vv                |
+-------------------+
2 rows in set (0.00 sec)

mysql> insert into textdatatypes values ('123','123','string is accepted');
ERROR 1146 (42S02): Table 'vaibhav.textdatatypes' doesn't exist
mysql> insert into textdatatype values ('123','123','string is accepted');
Query OK, 1 row affected (0.05 sec)

mysql> select*from textdatatype;
+------+------+--------------------+
| a    | b    | c                  |
+------+------+--------------------+
| 123  | 123  | string is accepted |
+------+------+--------------------+
1 row in set (0.00 sec)

mysql> insert into textdatatype values ('163','123','string is accepted');
Query OK, 1 row affected (0.02 sec)

mysql> select*from textdatatype;
+------+------+--------------------+
| a    | b    | c                  |
+------+------+--------------------+
| 123  | 123  | string is accepted |
| 163  | 123  | string is accepted |
+------+------+--------------------+
2 rows in set (0.00 sec)

mysql> update textdatatype a=5555555 where a=123;
ERROR 1064 (42000): You have an error in your SQL syntax; check the manual that corresponds to your MySQL server version for the right syntax to use near '=5555555 where a=123' at line 1
mysql> update textdatatype a=120 where a=123;
ERROR 1064 (42000): You have an error in your SQL syntax; check the manual that corresponds to your MySQL server version for the right syntax to use near '=120 where a=123' at line 1
mysql> update textdatatype set a=120 where a=123;
Query OK, 1 row affected (0.03 sec)
Rows matched: 1  Changed: 1  Warnings: 0

mysql> select*from textdatatype;
+------+------+--------------------+
| a    | b    | c                  |
+------+------+--------------------+
| 120  | 123  | string is accepted |
| 163  | 123  | string is accepted |
+------+------+--------------------+
2 rows in set (0.00 sec)

mysql> update textdatatype set a=123344 where a=123;
Query OK, 0 rows affected (0.00 sec)
Rows matched: 0  Changed: 0  Warnings: 0

mysql> select*from textdatatype;
+------+------+--------------------+
| a    | b    | c                  |
+------+------+--------------------+
| 120  | 123  | string is accepted |
| 163  | 123  | string is accepted |
+------+------+--------------------+
2 rows in set (0.00 sec)

mysql> update textdatatype set a=1233323 where a=120;
Query OK, 1 row affected (0.02 sec)
Rows matched: 1  Changed: 1  Warnings: 0

mysql> select*from textdatatype;
+---------+------+--------------------+
| a       | b    | c                  |
+---------+------+--------------------+
| 1233323 | 123  | string is accepted |
| 163     | 123  | string is accepted |
+---------+------+--------------------+
2 rows in set (0.00 sec)

mysql> update textdatatype set a=1233441111 where a=123;
Query OK, 0 rows affected (0.00 sec)
Rows matched: 0  Changed: 0  Warnings: 0

mysql> update textdatatype set a=12334411112221221122511144111 where a=123;
Query OK, 0 rows affected (0.00 sec)
Rows matched: 0  Changed: 0  Warnings: 0

mysql> select*from textdatatype;
+---------+------+--------------------+
| a       | b    | c                  |
+---------+------+--------------------+
| 1233323 | 123  | string is accepted |
| 163     | 123  | string is accepted |
+---------+------+--------------------+
2 rows in set (0.00 sec)

mysql> update textdatatype set a=1233323554455244584455 where a=1233323;
ERROR 1406 (22001): Data too long for column 'a' at row 1
mysql> select length(a),length(b),length(c) from textdatatype;
+-----------+-----------+-----------+
| length(a) | length(b) | length(c) |
+-----------+-----------+-----------+
|         7 |         3 |        18 |
|         3 |         3 |        18 |
+-----------+-----------+-----------+
2 rows in set (0.02 sec)

mysql> crate table numdatatype ( a tinyint, b smallint, c mediumint, d int, e bigint, f decimal(8,2), g double(8,2), h float);
ERROR 1064 (42000): You have an error in your SQL syntax; check the manual that corresponds to your MySQL server version for the right syntax to use near 'crate table numdatatype ( a tinyint, b smallint, c mediumint, d int, e bigint, f' at line 1
mysql> create table numdatatype ( a tinyint, b smallint, c mediumint, d int, e bigint, f decimal(8,2), g double(8,2), h float);
Query OK, 0 rows affected (0.10 sec)

mysql> insert into numdatatype values(130,120,33464,333334,34343434343,999999.99,999999.99,99999.99);
ERROR 1264 (22003): Out of range value for column 'a' at row 1
mysql> insert into numdatatype values(120,120,33464,333334,34343434343,999999.99,999999.99,99999.99);
Query OK, 1 row affected (0.05 sec)

mysql> insert into numdatatype values(120,120,33464,333334,34343434343,999999.9,999999.99,999.99);
Query OK, 1 row affected (0.02 sec)

mysql> insert into numdatatype values(120,120,33464,333334,34343434343,9999999.9,999999.99,999.99);
ERROR 1264 (22003): Out of range value for column 'f' at row 1
mysql> select * from numdatatype;
+------+------+-------+--------+-------------+-----------+-----------+--------+
| a    | b    | c     | d      | e           | f         | g         | h      |
+------+------+-------+--------+-------------+-----------+-----------+--------+
|  120 |  120 | 33464 | 333334 | 34343434343 | 999999.99 | 999999.99 | 100000 |
|  120 |  120 | 33464 | 333334 | 34343434343 | 999999.90 | 999999.99 | 999.99 |
+------+------+-------+--------+-------------+-----------+-----------+--------+
2 rows in set (0.00 sec)

mysql> create table datedatatypes (1 date,2 datetime, 3 timestamp, 4 time);
ERROR 1064 (42000): You have an error in your SQL syntax; check the manual that corresponds to your MySQL server version for the right syntax to use near '1 date,2 datetime, 3 timestamp, 4 time)' at line 1
mysql> create table datedatatypes (a date,b datetime, c timestamp, d time);
Query OK, 0 rows affected (0.05 sec)

mysql> insert into datedatatypes values(current_date(),now(),now(),now());
Query OK, 1 row affected (0.03 sec)

mysql> select * from datedatatypes;
+------------+---------------------+---------------------+----------+
| a          | b                   | c                   | d        |
+------------+---------------------+---------------------+----------+
| 2019-08-26 | 2019-08-26 19:25:06 | 2019-08-26 19:25:06 | 19:25:06 |
+------------+---------------------+---------------------+----------+
1 row in set (0.00 sec)

mysql> insert into datedatatypes values(current_date(),now(),now(),current_time());
Query OK, 1 row affected (0.04 sec)

mysql> select * from datedatatypes;
+------------+---------------------+---------------------+----------+
| a          | b                   | c                   | d        |
+------------+---------------------+---------------------+----------+
| 2019-08-26 | 2019-08-26 19:25:06 | 2019-08-26 19:25:06 | 19:25:06 |
| 2019-08-26 | 2019-08-26 19:27:00 | 2019-08-26 19:27:00 | 19:27:00 |
+------------+---------------------+---------------------+----------+
2 rows in set (0.00 sec)

mysql> insert into datedatatypes values(current_date(),now(),now(),current_month());
ERROR 1305 (42000): FUNCTION vaibhav.current_month does not exist
mysql> create table datedatatypes (a date,b datetime, c timestamp, d month);
ERROR 1064 (42000): You have an error in your SQL syntax; check the manual that corresponds to your MySQL server version for the right syntax to use near 'month)' at line 1
mysql> create table spldatatypes ( ID int autoincrement primary key,membership enum ('silver','gold','platinum'), hobbies set ('swimming','sking','cricket','football'));
ERROR 1064 (42000): You have an error in your SQL syntax; check the manual that corresponds to your MySQL server version for the right syntax to use near 'autoincrement primary key,membership enum ('silver','gold','platinum'), hobbies ' at line 1
mysql> create table spldatatypes ( ID int auto-increment primary key,membership enum ('silver','gold','platinum'), hobbies set ('swimming','sking','cricket','football'));
ERROR 1064 (42000): You have an error in your SQL syntax; check the manual that corresponds to your MySQL server version for the right syntax to use near 'auto-increment primary key,membership enum ('silver','gold','platinum'), hobbies' at line 1
mysql> create table spldatatypes ( ID int auto_increment primary key,membership enum ('silver','gold','platinum'), hobbies set ('swimming','sking','cricket','football'));
Query OK, 0 rows affected (0.09 sec)

mysql> select * from spldatatypes;
Empty set (0.00 sec)

mysql> insert into spldatatypes values ('silver','football');
ERROR 1136 (21S01): Column count doesn't match value count at row 1
mysql> insert into spldatatypes values ('silver','football','sking');
ERROR 1366 (HY000): Incorrect integer value: 'silver' for column 'ID' at row 1
mysql> insert into spldatatypes (membership,hobbies) values ('silver','football',);
ERROR 1064 (42000): You have an error in your SQL syntax; check the manual that corresponds to your MySQL server version for the right syntax to use near ')' at line 1
mysql> insert into spldatatypes (membership,hobbies); values ('silver','football',);
ERROR 1064 (42000): You have an error in your SQL syntax; check the manual that corresponds to your MySQL server version for the right syntax to use near '' at line 1
ERROR 1064 (42000): You have an error in your SQL syntax; check the manual that corresponds to your MySQL server version for the right syntax to use near 'values ('silver','football',)' at line 1
mysql> insert into spldatatypes (membership,hobbies) values ('silver','football');
Query OK, 1 row affected (0.04 sec)

mysql> select * from spldatatypes;
+----+------------+----------+
| ID | membership | hobbies  |
+----+------------+----------+
|  1 | silver     | football |
+----+------------+----------+
1 row in set (0.00 sec)

mysql> insert into spldatatypes (membership,hobbies) values ('vaibhav','football',);
ERROR 1064 (42000): You have an error in your SQL syntax; check the manual that corresponds to your MySQL server version for the right syntax to use near ')' at line 1
mysql> insert into spldatatypes (membership,hobbies) values ('vaibhav','football');
ERROR 1265 (01000): Data truncated for column 'membership' at row 1
mysql> insert into spldatatypes (membership,hobbies) values ('gold','football');
Query OK, 1 row affected (0.02 sec)

mysql> select * from productcategory;
ERROR 1146 (42S02): Table 'vaibhav.productcategory' doesn't exist
mysql> create table product (id int primary key, name varchar(20));
Query OK, 0 rows affected (0.11 sec)

mysql> insert into product values(1,'aaa');
Query OK, 1 row affected (0.03 sec)

mysql> insert into product values(2,'bbb');
Query OK, 1 row affected (0.03 sec)

mysql> insert into product values(3,'ccc');
Query OK, 1 row affected (0.04 sec)

mysql> insert into product values(4,'ddd');
Query OK, 1 row affected (0.04 sec)

mysql> insert into product values(5,'ee');
Query OK, 1 row affected (0.05 sec)

mysql> insert into product values(6,'gg');
Query OK, 1 row affected (0.03 sec)

mysql> select * from product;
+----+------+
| id | name |
+----+------+
|  1 | aaa  |
|  2 | bbb  |
|  3 | ccc  |
|  4 | ddd  |
|  5 | ee   |
|  6 | gg   |
+----+------+
6 rows in set (0.00 sec)

mysql> select * from product order by name;
+----+------+
| id | name |
+----+------+
|  1 | aaa  |
|  2 | bbb  |
|  3 | ccc  |
|  4 | ddd  |
|  5 | ee   |
|  6 | gg   |
+----+------+
6 rows in set (0.00 sec)

mysql> select * from product order by name desc;
+----+------+
| id | name |
+----+------+
|  6 | gg   |
|  5 | ee   |
|  4 | ddd  |
|  3 | ccc  |
|  2 | bbb  |
|  1 | aaa  |
+----+------+
6 rows in set (0.00 sec)

mysql> select * from product order by id desc;
+----+------+
| id | name |
+----+------+
|  6 | gg   |
|  5 | ee   |
|  4 | ddd  |
|  3 | ccc  |
|  2 | bbb  |
|  1 | aaa  |
+----+------+
6 rows in set (0.00 sec)

mysql> select * from product order by name asc, id desc;
+----+------+
| id | name |
+----+------+
|  1 | aaa  |
|  2 | bbb  |
|  3 | ccc  |
|  4 | ddd  |
|  5 | ee   |
|  6 | gg   |
+----+------+
6 rows in set (0.00 sec)

mysql> select * from product order by id desc, name asc;
+----+------+
| id | name |
+----+------+
|  6 | gg   |
|  5 | ee   |
|  4 | ddd  |
|  3 | ccc  |
|  2 | bbb  |
|  1 | aaa  |
+----+------+
6 rows in set (0.00 sec)

mysql> create table product (id int, name varchar(20));
ERROR 1050 (42S01): Table 'product' already exists
mysql> create table prod (id int, name varchar(20));
Query OK, 0 rows affected (0.05 sec)

mysql> insert into prod values(5,'ee');
Query OK, 1 row affected (0.03 sec)

mysql> insert into prod values(4,'fg');
Query OK, 1 row affected (0.04 sec)

mysql> insert into prod values(3,'kg');
Query OK, 1 row affected (0.02 sec)

mysql> insert into prod values(1,'ng');
Query OK, 1 row affected (0.02 sec)

mysql> insert into prod values(1,'wg');
Query OK, 1 row affected (0.03 sec)

mysql> select * from prod;
+------+------+
| id   | name |
+------+------+
|    5 | ee   |
|    4 | fg   |
|    3 | kg   |
|    1 | ng   |
|    1 | wg   |
+------+------+
5 rows in set (0.00 sec)

mysql> select * from prod order by id ;
+------+------+
| id   | name |
+------+------+
|    1 | ng   |
|    1 | wg   |
|    3 | kg   |
|    4 | fg   |
|    5 | ee   |
+------+------+
5 rows in set (0.00 sec)

mysql> select * from prod order by name desc ;
+------+------+
| id   | name |
+------+------+
|    1 | wg   |
|    1 | ng   |
|    3 | kg   |
|    4 | fg   |
|    5 | ee   |
+------+------+
5 rows in set (0.00 sec)

mysql> select * from prod order by id desc, name asc ;
+------+------+
| id   | name |
+------+------+
|    5 | ee   |
|    4 | fg   |
|    3 | kg   |
|    1 | ng   |
|    1 | wg   |
+------+------+
5 rows in set (0.00 sec)

mysql> select id as d from prod order by d desc, name asc ;
+------+
| d    |
+------+
|    5 |
|    4 |
|    3 |
|    1 |
|    1 |
+------+
5 rows in set (0.00 sec)

mysql> select id as d,name from prod order by d desc, name asc ;
+------+------+
| d    | name |
+------+------+
|    5 | ee   |
|    4 | fg   |
|    3 | kg   |
|    1 | ng   |
|    1 | wg   |
+------+------+
5 rows in set (0.00 sec)

mysql> select * from productsubcategory
    -> select * from product
    -> select * from productsubcategory;
ERROR 1064 (42000): You have an error in your SQL syntax; check the manual that corresponds to your MySQL server version for the right syntax to use near 'select * from product
select * from productsubcategory' at line 2
mysql> select * from product;
+----+------+
| id | name |
+----+------+
|  1 | aaa  |
|  2 | bbb  |
|  3 | ccc  |
|  4 | ddd  |
|  5 | ee   |
|  6 | gg   |
+----+------+
6 rows in set (0.00 sec)

mysql> select product id from product order by 2;
ERROR 1054 (42S22): Unknown column 'product' in 'field list'
mysql> select id from product order by 2;
ERROR 1054 (42S22): Unknown column '2' in 'order clause'
mysql>