Enter password: ****
Welcome to the MySQL monitor.  Commands end with ; or \g.
Your MySQL connection id is 1
Server version: 5.5.61 MySQL Community Server (GPL)

Copyright (c) 2000, 2018, Oracle and/or its affiliates. All rights reserved.

Oracle is a registered trademark of Oracle Corporation and/or its
affiliates. Other names may be trademarks of their respective
owners.

Type 'help;' or '\h' for help. Type '\c' to clear the current input statement.

mysql> show databases;
+--------------------+
| Database           |
+--------------------+
| information_schema |
| assignment         |
| db                 |
| dbda               |
| mydb               |
| mysql              |
| nikita             |
| nirmal             |
| performance_schema |
| test               |
| vaibhav            |
| vita               |
| vita_db            |
| vita_dbda          |
| whitehouse         |
+--------------------+
15 rows in set (0.17 sec)

mysql> create database adventureworks;
Query OK, 1 row affected (0.01 sec)

mysql> use adventureworks;
Database changed
mysql> create table book ( memberid auto_increment primary key, Fname varchar(20) not null, Mname varchar(10),Sname varchar(20) not null, mem_DOJ date,Email varchar(30) unique, phone char (10), mem_type enum('Regular','silver','gold','premium') );
ERROR 1064 (42000): You have an error in your SQL syntax; check the manual that corresponds to your MySQL server version for the right syntax to use near 'auto_increment primary key, Fname varchar(20) not null, Mname varchar(10),Sname ' at line 1
mysql> create table book ( memberid auto_increment primary key, Fname varchar(20) not null, Mname varchar(10),Lname varchar(20) not null, mem_DOJ date,Email varchar(30) unique, phone char (10), mem_type enum('Regular','silver','gold','premium') );
ERROR 1064 (42000): You have an error in your SQL syntax; check the manual that corresponds to your MySQL server version for the right syntax to use near 'auto_increment primary key, Fname varchar(20) not null, Mname varchar(10),Lname ' at line 1
mysql> create table book ( memberid auto_increment primary key, Fname varchar(20), Mname varchar(10),Lname varchar(20), mem_DOJ date,Email varchar(30) unique, phone char (10), mem_type enum('Regular','silver','gold','premium') );
ERROR 1064 (42000): You have an error in your SQL syntax; check the manual that corresponds to your MySQL server version for the right syntax to use near 'auto_increment primary key, Fname varchar(20), Mname varchar(10),Lname varchar(2' at line 1
mysql> create table member ( memberid auto_increment primary key, Fname varchar(20) not null, Mname varchar(10),Lname varchar(20) not null, mem_DOJ date,Email varchar(30), phone char (10), mem_type enum('Regular','silver','gold','premium') );
ERROR 1064 (42000): You have an error in your SQL syntax; check the manual that corresponds to your MySQL server version for the right syntax to use near 'auto_increment primary key, Fname varchar(20) not null, Mname varchar(10),Lname ' at line 1
mysql> create table member ( memberid int auto_increment primary key, Fname varchar(20) not null, Mname varchar(10),Lname varchar(20) not null, mem_DOJ date,Email varchar(30), phone char (10), mem_type enum('Regular','silver','gold','premium') );
Query OK, 0 rows affected (0.16 sec)

mysql> insert into member (Fname,Mname,Lname,mem_DOJ date,Email,phone,mem_type) values ('nanny','manoj','lan',now(),'nannymanoj@123gmail.com',1234567890,'gold');
ERROR 1064 (42000): You have an error in your SQL syntax; check the manual that corresponds to your MySQL server version for the right syntax to use near 'date,Email,phone,mem_type) values ('nanny','manoj','lan',now(),'nannymanoj@123gm' at line 1
mysql> create table member ( memberid int auto_increment primary key, Fname varchar(20) not null, Mname varchar(10),Lname varchar(20) not null, mem_DOJ date,Email varchar(30), phone char (10), mem_type enum('Regular','silver','gold','premium') );
ERROR 1050 (42S01): Table 'member' already exists
mysql> create table member ( memberid int auto_increment primary key, Fname varchar(20) not null, Mname varchar(10),Lname varchar(20) not null, mem_DOJ date,Email varchar(30), phone char (10), mem_type enum('Regular','silver','gold','premium') );
ERROR 1050 (42S01): Table 'member' already exists
mysql>
mysql>
mysql>
mysql>
mysql>
mysql>
mysql>
mysql>
mysql>
mysql>
mysql>
mysql>
mysql>
mysql>
mysql>
mysql>
mysql>
mysql>
mysql>
mysql>
mysql>
mysql>
mysql>
mysql>
mysql>
mysql>
mysql>
mysql>
mysql>
mysql>
mysql>
mysql>
mysql>
mysql>
mysql>
mysql>
mysql>
mysql> drop table member;
Query OK, 0 rows affected (0.02 sec)

mysql> create table member ( memberid int auto_increment primary key, Fname varchar(20) not null, Mname varchar(10),Lname varchar(20) not null, mem_DOJ date,Email varchar(30), phone char (10), mem_type enum('Regular','silver','gold','premium') );
Query OK, 0 rows affected (0.05 sec)

mysql> insert into member (Fname,Mname,Lname,mem_DOJ date,Email,phone,mem_type) values ('nanny','manoj','lan',now(),'nannymanoj@123gmail.com',1234567890,'gold');
ERROR 1064 (42000): You have an error in your SQL syntax; check the manual that corresponds to your MySQL server version for the right syntax to use near 'date,Email,phone,mem_type) values ('nanny','manoj','lan',now(),'nannymanoj@123gm' at line 1
mysql> insert into member (Fname,Mname,Lname,mem_DOJ,Email,phone,mem_type) values ('nanny','manoj','lan',now(),'nannymanoj@123gmail.com',1234567890,'gold');
Query OK, 1 row affected, 1 warning (0.02 sec)

mysql> insert into member (Fname,Mname,Lname,mem_DOJ,Email,phone,mem_type) values ('nanny',null,'lan',now(),'nannymanoj@123gmail.com',9876543210,'gold');
Query OK, 1 row affected, 1 warning (0.03 sec)

mysql> select * from member;
+----------+-------+-------+-------+------------+-------------------------+------------+----------+
| memberid | Fname | Mname | Lname | mem_DOJ    | Email                   | phone      | mem_type |
+----------+-------+-------+-------+------------+-------------------------+------------+----------+
|        1 | nanny | manoj | lan   | 2019-08-27 | nannymanoj@123gmail.com | 1234567890 | gold     |
|        2 | nanny | NULL  | lan   | 2019-08-27 | nannymanoj@123gmail.com | 9876543210 | gold     |
+----------+-------+-------+-------+------------+-------------------------+------------+----------+
2 rows in set (0.00 sec)

mysql> alter table member add constraint mem_email_UQ unique(email);
ERROR 1062 (23000): Duplicate entry 'nannymanoj@123gmail.com' for key 'mem_email_UQ'
mysql> update member set email=sss@gmail.com where email=nannymanoj@123gmail.com;
ERROR 1064 (42000): You have an error in your SQL syntax; check the manual that corresponds to your MySQL server version for the right syntax to use near '@gmail.com where email=nannymanoj@123gmail.com' at line 1
mysql> drop table member;
Query OK, 0 rows affected (0.03 sec)

mysql> create table member ( memberid int auto_increment primary key, Fname varchar(20) not null, Mname varchar(10),Lname varchar(20) not null, mem_DOJ date,Email varchar(30)unique, phone char (10), mem_type enum('Regular','silver','gold','premium') );
Query OK, 0 rows affected (0.04 sec)

mysql> insert into member (Fname,Mname,Lname,mem_DOJ,Email,phone,mem_type) values ('nanny',null,'lan',now(),'nannymanoj@123gmail.com',9876543210,'gold');
Query OK, 1 row affected, 1 warning (0.02 sec)

mysql> insert into member (Fname,Mname,Lname,mem_DOJ,Email,phone,mem_type) values ('nanny','manoj','lan',now(),'nannymanoj@123gmail.com',1234567890,'gold');
ERROR 1062 (23000): Duplicate entry 'nannymanoj@123gmail.com' for key 'Email'
mysql> drop table member;
Query OK, 0 rows affected (0.02 sec)

mysql> create table member ( memberid int auto_increment primary key, Fname varchar(20) not null, Mname varchar(10),Lname varchar(20) not null, mem_DOJ date,Email varchar(30), phone char (10), mem_type enum('Regular','silver','gold','premium') );
Query OK, 0 rows affected (0.05 sec)

mysql> insert into member (Fname,Mname,Lname,mem_DOJ date,Email,phone,mem_type) values ('nanny','manoj','lan',now(),'nannymanoj@123gmail.com',1234567890,'gold');
ERROR 1064 (42000): You have an error in your SQL syntax; check the manual that corresponds to your MySQL server version for the right syntax to use near 'date,Email,phone,mem_type) values ('nanny','manoj','lan',now(),'nannymanoj@123gm' at line 1
mysql> insert into member (Fname,Mname,Lname,mem_DOJ,Email,phone,mem_type) values ('nanny','manoj','lan',now(),'nannymanoj@123gmail.com',1234567890,'gold');
Query OK, 1 row affected, 1 warning (0.02 sec)

mysql> insert into member (Fname,Mname,Lname,mem_DOJ,Email,phone,mem_type) values ('nanny','manoj','lan',now(),'ymanoj@123gmail.com',1234567890,'gold');
Query OK, 1 row affected, 1 warning (0.03 sec)

mysql> select * from member;
+----------+-------+-------+-------+------------+-------------------------+------------+----------+
| memberid | Fname | Mname | Lname | mem_DOJ    | Email                   | phone      | mem_type |
+----------+-------+-------+-------+------------+-------------------------+------------+----------+
|        1 | nanny | manoj | lan   | 2019-08-27 | nannymanoj@123gmail.com | 1234567890 | gold     |
|        2 | nanny | manoj | lan   | 2019-08-27 | ymanoj@123gmail.com     | 1234567890 | gold     |
+----------+-------+-------+-------+------------+-------------------------+------------+----------+
2 rows in set (0.00 sec)

mysql> alter table member add constraint mem_email_unq unique(email);
Query OK, 0 rows affected (0.13 sec)
Records: 0  Duplicates: 0  Warnings: 0

mysql> insert into member (Fname,Mname,Lname,mem_DOJ,Email,phone,mem_type) values ('nanny','manoj','lan',now(),'ymanoj@123gmail.com',1234567890,'gold');
ERROR 1062 (23000): Duplicate entry 'ymanoj@123gmail.com' for key 'mem_email_unq'
mysql> insert into member (Fname,Mname,Lname,mem_DOJ,Email,phone,mem_type) values ('nanny','manoj','lan',now(),'noj@123gmail.com',1234567890,'gold');
Query OK, 1 row affected, 1 warning (0.02 sec)

mysql> describe member;
+----------+-------------------------------------------+------+-----+---------+----------------+
| Field    | Type                                      | Null | Key | Default | Extra          |
+----------+-------------------------------------------+------+-----+---------+----------------+
| memberid | int(11)                                   | NO   | PRI | NULL    | auto_increment |
| Fname    | varchar(20)                               | NO   |     | NULL    |                |
| Mname    | varchar(10)                               | YES  |     | NULL    |                |
| Lname    | varchar(20)                               | NO   |     | NULL    |                |
| mem_DOJ  | date                                      | YES  |     | NULL    |                |
| Email    | varchar(30)                               | YES  | UNI | NULL    |                |
| phone    | char(10)                                  | YES  |     | NULL    |                |
| mem_type | enum('Regular','silver','gold','premium') | YES  |     | NULL    |                |
+----------+-------------------------------------------+------+-----+---------+----------------+
8 rows in set (0.01 sec)

mysql> insert into member (Fname,Mname,Lname,mem_DOJ,Email,phone,mem_type) values (null,'manoj','lan',now(),'noj@123gmail.com',1234567890,'gold');
ERROR 1048 (23000): Column 'Fname' cannot be null
mysql> insert into member (Fname,Mname,Lname,mem_DOJ,Email,phone,mem_type) values ('sss','manoj','lan',now(),'noj@123gmail.com',1234567890,'gold');
ERROR 1062 (23000): Duplicate entry 'noj@123gmail.com' for key 'mem_email_unq'
mysql> insert into member (Fname,Mname,Lname,mem_DOJ,Email,phone,mem_type) values ('sss','manoj','lan',now(),'ssnoj@123gmail.com',1234567890,'gold');
Query OK, 1 row affected, 1 warning (0.02 sec)

mysql> select* from member;
+----------+-------+-------+-------+------------+-------------------------+------------+----------+
| memberid | Fname | Mname | Lname | mem_DOJ    | Email                   | phone      | mem_type |
+----------+-------+-------+-------+------------+-------------------------+------------+----------+
|        1 | nanny | manoj | lan   | 2019-08-27 | nannymanoj@123gmail.com | 1234567890 | gold     |
|        2 | nanny | manoj | lan   | 2019-08-27 | ymanoj@123gmail.com     | 1234567890 | gold     |
|        4 | nanny | manoj | lan   | 2019-08-27 | noj@123gmail.com        | 1234567890 | gold     |
|        6 | sss   | manoj | lan   | 2019-08-27 | ssnoj@123gmail.com      | 1234567890 | gold     |
+----------+-------+-------+-------+------------+-------------------------+------------+----------+
4 rows in set (0.00 sec)

mysql> show tables;
+--------------------------+
| Tables_in_adventureworks |
+--------------------------+
| member                   |
+--------------------------+
1 row in set (0.00 sec)

mysql> create table book ( bookid int auto_increment primary key, bookname varchar(30) not null , price decimal (6,2) );
Query OK, 0 rows affected (0.06 sec)

mysql> insert into book (bookname,price) values ('abc',400.45);
Query OK, 1 row affected (0.04 sec)

mysql> insert into book (bookname,price) values ('def',400.455);
Query OK, 1 row affected, 1 warning (0.03 sec)

mysql> insert into book (bookname,price) values (2,'yui',400.45);
ERROR 1136 (21S01): Column count doesn't match value count at row 1
mysql> describe book;
+----------+--------------+------+-----+---------+----------------+
| Field    | Type         | Null | Key | Default | Extra          |
+----------+--------------+------+-----+---------+----------------+
| bookid   | int(11)      | NO   | PRI | NULL    | auto_increment |
| bookname | varchar(30)  | NO   |     | NULL    |                |
| price    | decimal(6,2) | YES  |     | NULL    |                |
+----------+--------------+------+-----+---------+----------------+
3 rows in set (0.01 sec)

mysql> select * from book;
+--------+----------+--------+
| bookid | bookname | price  |
+--------+----------+--------+
|      1 | abc      | 400.45 |
|      2 | def      | 400.46 |
+--------+----------+--------+
2 rows in set (0.00 sec)

mysql> insert into book (bookname,price) values (3,'yui',400.45);
ERROR 1136 (21S01): Column count doesn't match value count at row 1
mysql> insert into book (bookname,price) values('yui',null);
Query OK, 1 row affected (0.02 sec)

mysql> select * from book;
+--------+----------+--------+
| bookid | bookname | price  |
+--------+----------+--------+
|      1 | abc      | 400.45 |
|      2 | def      | 400.46 |
|      3 | yui      |   NULL |
+--------+----------+--------+
3 rows in set (0.00 sec)

mysql> insert into book (bookname,price) values ('yui',0);
Query OK, 1 row affected (0.04 sec)

mysql> select * from book;
+--------+----------+--------+
| bookid | bookname | price  |
+--------+----------+--------+
|      1 | abc      | 400.45 |
|      2 | def      | 400.46 |
|      3 | yui      |   NULL |
|      4 | yui      |   0.00 |
+--------+----------+--------+
4 rows in set (0.00 sec)

mysql> alter table bok
    -> ;
ERROR 1146 (42S02): Table 'adventureworks.bok' doesn't exist
mysql> alter table book add column author varchar(40) not null;
Query OK, 4 rows affected (0.18 sec)
Records: 4  Duplicates: 0  Warnings: 0

mysql> select * from book;
+--------+----------+--------+--------+
| bookid | bookname | price  | author |
+--------+----------+--------+--------+
|      1 | abc      | 400.45 |        |
|      2 | def      | 400.46 |        |
|      3 | yui      |   NULL |        |
|      4 | yui      |   0.00 |        |
+--------+----------+--------+--------+
4 rows in set (0.00 sec)

mysql> alter table book modify column author char(30) not null;
Query OK, 4 rows affected (0.16 sec)
Records: 4  Duplicates: 0  Warnings: 0

mysql> select * from book;
+--------+----------+--------+--------+
| bookid | bookname | price  | author |
+--------+----------+--------+--------+
|      1 | abc      | 400.45 |        |
|      2 | def      | 400.46 |        |
|      3 | yui      |   NULL |        |
|      4 | yui      |   0.00 |        |
+--------+----------+--------+--------+
4 rows in set (0.00 sec)

mysql> alter table book modify column pages varchar(40) not null;
ERROR 1054 (42S22): Unknown column 'pages' in 'book'
mysql> alter table book modify column author as pages varchar(40) not null;
ERROR 1064 (42000): You have an error in your SQL syntax; check the manual that corresponds to your MySQL server version for the right syntax to use near 'as pages varchar(40) not null' at line 1
mysql> select author as pages from book;
+-------+
| pages |
+-------+
|       |
|       |
|       |
|       |
+-------+
4 rows in set (0.00 sec)

mysql> insert into book(pages)values(ritesh,sagar);
ERROR 1054 (42S22): Unknown column 'ritesh' in 'field list'
mysql> insert into book(pages)values(ritesh);
ERROR 1054 (42S22): Unknown column 'ritesh' in 'field list'
mysql> insert into book(author)values(ritesh);
ERROR 1054 (42S22): Unknown column 'ritesh' in 'field list'
mysql> insert into book(author)values('ritesh');
ERROR 1364 (HY000): Field 'bookname' doesn't have a default value
mysql> insert into book(pages)values('ritesh');
ERROR 1054 (42S22): Unknown column 'pages' in 'field list'
mysql> select * from book;
+--------+----------+--------+--------+
| bookid | bookname | price  | author |
+--------+----------+--------+--------+
|      1 | abc      | 400.45 |        |
|      2 | def      | 400.46 |        |
|      3 | yui      |   NULL |        |
|      4 | yui      |   0.00 |        |
+--------+----------+--------+--------+
4 rows in set (0.00 sec)

mysql> insert into book(author)values('ritesh');
ERROR 1364 (HY000): Field 'bookname' doesn't have a default value
mysql> insert into book(author)values('ritesh')
    -> WHERE bookid = 1;
ERROR 1064 (42000): You have an error in your SQL syntax; check the manual that corresponds to your MySQL server version for the right syntax to use near 'WHERE bookid = 1' at line 2
mysql> select * from book;
+--------+----------+--------+--------+
| bookid | bookname | price  | author |
+--------+----------+--------+--------+
|      1 | abc      | 400.45 |        |
|      2 | def      | 400.46 |        |
|      3 | yui      |   NULL |        |
|      4 | yui      |   0.00 |        |
+--------+----------+--------+--------+
4 rows in set (0.00 sec)

mysql> insert into book(author)values('ritesh');
ERROR 1364 (HY000): Field 'bookname' doesn't have a default value
mysql> insert into add book(author) values ('ritesh')
    -> ;
ERROR 1064 (42000): You have an error in your SQL syntax; check the manual that corresponds to your MySQL server version for the right syntax to use near 'add book(author) values ('ritesh')' at line 1
mysql> insert into book(bookname,price,author) values ('xyz',-560,'ritesh');
Query OK, 1 row affected (0.03 sec)

mysql> select * from book;
+--------+----------+---------+--------+
| bookid | bookname | price   | author |
+--------+----------+---------+--------+
|      1 | abc      |  400.45 |        |
|      2 | def      |  400.46 |        |
|      3 | yui      |    NULL |        |
|      4 | yui      |    0.00 |        |
|      5 | xyz      | -560.00 | ritesh |
+--------+----------+---------+--------+
5 rows in set (0.00 sec)

mysql> insert into book set bookid=1 where author='sss';
ERROR 1064 (42000): You have an error in your SQL syntax; check the manual that corresponds to your MySQL server version for the right syntax to use near 'where author='sss'' at line 1
mysql> select * from book;
+--------+----------+---------+--------+
| bookid | bookname | price   | author |
+--------+----------+---------+--------+
|      1 | abc      |  400.45 |        |
|      2 | def      |  400.46 |        |
|      3 | yui      |    NULL |        |
|      4 | yui      |    0.00 |        |
|      5 | xyz      | -560.00 | ritesh |
+--------+----------+---------+--------+
5 rows in set (0.00 sec)

mysql> update book
    -> set author = 'mcgraw'
    -> where bookid = 1;
Query OK, 1 row affected (0.03 sec)
Rows matched: 1  Changed: 1  Warnings: 0

mysql> select * from book;
+--------+----------+---------+--------+
| bookid | bookname | price   | author |
+--------+----------+---------+--------+
|      1 | abc      |  400.45 | mcgraw |
|      2 | def      |  400.46 |        |
|      3 | yui      |    NULL |        |
|      4 | yui      |    0.00 |        |
|      5 | xyz      | -560.00 | ritesh |
+--------+----------+---------+--------+
5 rows in set (0.00 sec)

mysql> delete from book where bookid = 2;
Query OK, 1 row affected (0.03 sec)

mysql> select * from book;
+--------+----------+---------+--------+
| bookid | bookname | price   | author |
+--------+----------+---------+--------+
|      1 | abc      |  400.45 | mcgraw |
|      3 | yui      |    NULL |        |
|      4 | yui      |    0.00 |        |
|      5 | xyz      | -560.00 | ritesh |
+--------+----------+---------+--------+
4 rows in set (0.00 sec)

mysql> INSERT INTO Book
    -> (BookName, Price) VALUES
    -> ('HTML5 Step by Step', NULL),
    -> ('Java Unleashed', -560);
ERROR 1364 (HY000): Field 'author' doesn't have a default value
mysql> INSERT INTO Book
    -> (BookName, Price) VALUES
    -> ('HTML5 Step by Step', NULL),
    -> ('Java Unleashed', -560);
ERROR 1364 (HY000): Field 'author' doesn't have a default value
mysql>
mysql>
mysql> INSERT INTO Book
    -> (BookName, Price) VALUES
    -> ('HTML5 Step by Step', NULL),
    -> (BookName, Price) VALUES;
ERROR 1064 (42000): You have an error in your SQL syntax; check the manual that corresponds to your MySQL server version for the right syntax to use near 'VALUES' at line 4
mysql> alter table book
    -> drop column author;
Query OK, 4 rows affected (0.18 sec)
Records: 4  Duplicates: 0  Warnings: 0

mysql> select * from book;
+--------+----------+---------+
| bookid | bookname | price   |
+--------+----------+---------+
|      1 | abc      |  400.45 |
|      3 | yui      |    NULL |
|      4 | yui      |    0.00 |
|      5 | xyz      | -560.00 |
+--------+----------+---------+
4 rows in set (0.00 sec)

mysql>
mysql>
mysql> INSERT INTO Book
    -> (BookName, Price) VALUES
    -> ('HTML5 Step by Step', NULL),
    -> ('Java Unleashed', -560);
Query OK, 2 rows affected (0.03 sec)
Records: 2  Duplicates: 0  Warnings: 0

mysql> select * from book;
+--------+--------------------+---------+
| bookid | bookname           | price   |
+--------+--------------------+---------+
|      1 | abc                |  400.45 |
|      3 | yui                |    NULL |
|      4 | yui                |    0.00 |
|      5 | xyz                | -560.00 |
|      6 | HTML5 Step by Step |    NULL |
|      7 | Java Unleashed     | -560.00 |
+--------+--------------------+---------+
6 rows in set (0.00 sec)

mysql> ALTER TABLE Book
    ->   DROP CONSTRAINT Book_Price_CHK;
ERROR 1064 (42000): You have an error in your SQL syntax; check the manual that corresponds to your MySQL server version for the right syntax to use near 'CONSTRAINT Book_Price_CHK' at line 2
mysql> INSERT INTO Book
    -> (BookName, Price) VALUES
    -> ('.Net Unleashed', 100);
Query OK, 1 row affected (0.04 sec)

mysql> select * from book;
+--------+--------------------+---------+
| bookid | bookname           | price   |
+--------+--------------------+---------+
|      1 | abc                |  400.45 |
|      3 | yui                |    NULL |
|      4 | yui                |    0.00 |
|      5 | xyz                | -560.00 |
|      6 | HTML5 Step by Step |    NULL |
|      7 | Java Unleashed     | -560.00 |
|      8 | .Net Unleashed     |  100.00 |
+--------+--------------------+---------+
7 rows in set (0.00 sec)

mysql> drop TABLE T1
    -> CREATE TABLE T1
    -> (Price decimal(6, 2)
    ->  CONSTRAINT T1_CHK
    -> CHECK (Price BETWEEN 200
    ->           AND 3000 )
    -> );
ERROR 1064 (42000): You have an error in your SQL syntax; check the manual that corresponds to your MySQL server version for the right syntax to use near 'CREATE TABLE T1
(Price decimal(6, 2)
 CONSTRAINT T1_CHK
CHECK (Price BETWEEN 200' at line 2
mysql>
mysql> INSERT INTO T1 VALUES
    -> (100);
ERROR 1146 (42S02): Table 'adventureworks.t1' doesn't exist
mysql> CREATE TABLE BookTran
    -> (
    ->   TrnID int AUTO_INCREMENT
    ->     primary key,
    ->   TrnDate datetime,
    ->   BookID int REFERENCES
    ->   Book(BookID),
    ->   MemberID int,
    ->   CONSTRAINT BookTran_MemberID_FK
    ->    FOREIGN KEY(MemberID)
    ->    REFERENCES Member(MemberID)
    -> );
Query OK, 0 rows affected (0.11 sec)

mysql> describe table booktran;
ERROR 1064 (42000): You have an error in your SQL syntax; check the manual that corresponds to your MySQL server version for the right syntax to use near 'table booktran' at line 1
mysql> describe booktran;
+----------+----------+------+-----+---------+----------------+
| Field    | Type     | Null | Key | Default | Extra          |
+----------+----------+------+-----+---------+----------------+
| TrnID    | int(11)  | NO   | PRI | NULL    | auto_increment |
| TrnDate  | datetime | YES  |     | NULL    |                |
| BookID   | int(11)  | YES  |     | NULL    |                |
| MemberID | int(11)  | YES  | MUL | NULL    |                |
+----------+----------+------+-----+---------+----------------+
4 rows in set (0.01 sec)

mysql> DROP TABLE BookTran;
Query OK, 0 rows affected (0.04 sec)

mysql> CREATE TABLE BookTran
    -> (
    ->   TrnID int AUTO_INCREMENT
    ->     primary key,
    ->   TrnDate datetime,
    ->   BookID int REFERENCES
    ->   Book(BookID),
    ->   MemberID int REFERENCES
    ->   Member(MemberID)
    -> );
Query OK, 0 rows affected (0.05 sec)

mysql> describe booktran;
+----------+----------+------+-----+---------+----------------+
| Field    | Type     | Null | Key | Default | Extra          |
+----------+----------+------+-----+---------+----------------+
| TrnID    | int(11)  | NO   | PRI | NULL    | auto_increment |
| TrnDate  | datetime | YES  |     | NULL    |                |
| BookID   | int(11)  | YES  |     | NULL    |                |
| MemberID | int(11)  | YES  |     | NULL    |                |
+----------+----------+------+-----+---------+----------------+
4 rows in set (0.01 sec)

mysql> DROP TABLE BookTran;
Query OK, 0 rows affected (0.03 sec)

mysql> CREATE TABLE BookTran
    -> (
    ->   TrnID int AUTO_INCREMENT
    ->     primary key,
    ->   TrnDate datetime,
    ->   BookID int,
    ->   MemberID int,
    ->
    ->   CONSTRAINT BookTran_BookID_FK
    ->    FOREIGN KEY(BookID)
    ->    REFERENCES Book(BookID),
    ->
    ->   CONSTRAINT BookTran_MemberID_FK
    ->    FOREIGN KEY(MemberID)
    ->    REFERENCES Member(MemberID)
    -> );
Query OK, 0 rows affected (0.07 sec)

mysql> describe booktran;
+----------+----------+------+-----+---------+----------------+
| Field    | Type     | Null | Key | Default | Extra          |
+----------+----------+------+-----+---------+----------------+
| TrnID    | int(11)  | NO   | PRI | NULL    | auto_increment |
| TrnDate  | datetime | YES  |     | NULL    |                |
| BookID   | int(11)  | YES  | MUL | NULL    |                |
| MemberID | int(11)  | YES  | MUL | NULL    |                |
+----------+----------+------+-----+---------+----------------+
4 rows in set (0.01 sec)

mysql> INSERT INTO BookTran
    -> (TrnDate, BookID, MemberID)
    -> VALUES
    -> (NOW(), 4, 1);
Query OK, 1 row affected (0.03 sec)

mysql> describe booktran;
+----------+----------+------+-----+---------+----------------+
| Field    | Type     | Null | Key | Default | Extra          |
+----------+----------+------+-----+---------+----------------+
| TrnID    | int(11)  | NO   | PRI | NULL    | auto_increment |
| TrnDate  | datetime | YES  |     | NULL    |                |
| BookID   | int(11)  | YES  | MUL | NULL    |                |
| MemberID | int(11)  | YES  | MUL | NULL    |                |
+----------+----------+------+-----+---------+----------------+
4 rows in set (0.01 sec)

mysql> show booktran;
ERROR 1064 (42000): You have an error in your SQL syntax; check the manual that corresponds to your MySQL server version for the right syntax to use near 'booktran' at line 1
mysql> show tables;
+--------------------------+
| Tables_in_adventureworks |
+--------------------------+
| book                     |
| booktran                 |
| member                   |
+--------------------------+
3 rows in set (0.00 sec)

mysql> select * from booktran;
+-------+---------------------+--------+----------+
| TrnID | TrnDate             | BookID | MemberID |
+-------+---------------------+--------+----------+
|     1 | 2019-08-27 18:28:26 |      4 |        1 |
+-------+---------------------+--------+----------+
1 row in set (0.00 sec)

mysql> INSERT INTO BookTran
    -> (TrnDate, BookID, MemberID)
    -> VALUES
    -> (NOW(), 5, 10);
ERROR 1452 (23000): Cannot add or update a child row: a foreign key constraint fails (`adventureworks`.`booktran`, CONSTRAINT `BookTran_MemberID_FK` FOREIGN KEY (`MemberID`) REFERENCES `member` (`memberid`))
mysql> drop booktran;
ERROR 1064 (42000): You have an error in your SQL syntax; check the manual that corresponds to your MySQL server version for the right syntax to use near 'booktran' at line 1
mysql> drop table booktran;
Query OK, 0 rows affected (0.06 sec)

mysql> CREATE TABLE BookTran
    -> (
    ->   TrnID int AUTO_INCREMENT
    ->     primary key,
    ->   TrnDate datetime,
    ->   BookID int,
    ->   MemberID int,
    ->
    ->   CONSTRAINT BookTran_BookID_FK
    ->    FOREIGN KEY(BookID)
    ->    REFERENCES Book(BookID),
    ->
    ->   CONSTRAINT BookTran_MemberID_FK
    ->    FOREIGN KEY(MemberID)
    ->    REFERENCES Member(MemberID)
    -> );
Query OK, 0 rows affected (0.11 sec)

mysql>
mysql> INSERT INTO BookTran
    -> (TrnDate, BookID, MemberID)
    -> VALUES
    -> (NOW(), 5, 10);
ERROR 1452 (23000): Cannot add or update a child row: a foreign key constraint fails (`adventureworks`.`booktran`, CONSTRAINT `BookTran_MemberID_FK` FOREIGN KEY (`MemberID`) REFERENCES `member` (`memberid`))
mysql> INSERT INTO BookTran
    -> (TrnDate, BookID, MemberID)
    -> VALUES
    -> (NOW(), 10, 5);
ERROR 1452 (23000): Cannot add or update a child row: a foreign key constraint fails (`adventureworks`.`booktran`, CONSTRAINT `BookTran_BookID_FK` FOREIGN KEY (`BookID`) REFERENCES `book` (`bookid`))
mysql> create table booktrans ( transid int auto_increment primary key, transdate datetime, memberid int  constraint booktrans_memberid_FK foreign key(memberid) references member(memberid) );
ERROR 1064 (42000): You have an error in your SQL syntax; check the manual that corresponds to your MySQL server version for the right syntax to use near 'constraint booktrans_memberid_FK foreign key(memberid) references member(memberi' at line 1
mysql> create table booktrans ( transid int auto_increment primary key, transdate datetime, memberid int  constraint booktrans_memberid_FK foreign key(memberid) references member(memberid) );